<?xml version="1.0" encoding="UTF-8"?>
<wp xmlns:xsi="http://www.w3.org/2001/XMLSchema-instance" 
      xsi:noNamespaceSchemaLocation="http://www.osbitools.com/xsd/wp.xsd" 
      ver_max="1" ver_min="0" inc="1">
	<panels>
		<panel>
			<wwg_cont uid="1" idx="0" class_name="com.osbitools.containers.tab_box">
				<props>
					<prop name="id" value="com_osbitools_containers_tab_box_1"/>
				</props>
				<wwg_list>
					<wwg_cont uid="2" idx="0" class_name="com.osbitools.containers.tab_box">
						<props>
							<prop name="id" value="com_osbitools_containers_tab_box_2"/>
						</props>
						<wwg_list>
							<wwg_cont uid="5" idx="0" class_name="com.osbitools.containers.header_box">
								<props>
									<prop name="id" value="com_osbitools_containers_header_box_5"/>
								</props>
							</wwg_cont>
						</wwg_list>
					</wwg_cont>
				</wwg_list>
			</wwg_cont>
			<wwg_cont uid="3" idx="1" class_name="com.osbitools.containers.header_box">
				<props>
					<prop name="id" value="com_osbitools_containers_header_box_3"/>
				</props>
				<wwg_list>
					<wwg_cont uid="4" idx="0" class_name="com.osbitools.containers.tab_box">
						<props>
							<prop name="id" value="com_osbitools_containers_tab_box_4"/>
						</props>
					</wwg_cont>
				</wwg_list>
			</wwg_cont>
		</panel>
	</panels>
</wp>
